Sheet: Technical Notes
A5: AIDSRelief Kenya Technical Notes for the CDC quarterly report
A6: Technical notes explaining point of service data for the reporting period of October 1st to December 31st 2006 are listed below.
A7: As of December 31st 2006 there were 19 active local partner treatment facilities supported by the AIDSRelief program in Kenya. 2 local partner treatment facilities (EDARP and St. Marys) that were previously supported by AIDSRelief are no longer supported by AIDSRelief. In the last quarter AIDSRelief added 3 new local partners (Mater, Maseno and St Joseph Nyabondo). All local partner treatment facilities continue to enroll, treat and provide quality care for patients via the PEPFAR funded AIDSRelief program.
A8: For this reporting period, while some of the data are exact, other figures represent our best estimates for each required indicator. Below we include additional information that explains how numbers for the Quarterly Facility based Reporting Form were obtained and reported
A9: All local partner treatment facilities are now using electronic databases and / or spreadsheets to manage their patient records. 18 local partner treatment facilities use the recommend AIDSRelief CAREWare database that captures comprehensive clinical information on all patients. 1 local partner (Maua Methodist) uses a similar ACCESS database developed in house. For local partner treatment facilities that utilize 2 sources of data, routine comparison of key variables is encouraged to ensure the accuracy of the report. This has helped to improve the accuracy of the required indicators.
A10: Numbers reported are facility based (i.e. both NASCOP and PEPFAR and any other partner funding ARVs). Some AIDSRelief local partners receive NASCOP drugs which are not FDA approved. Although it is not AIDSRelief policy to utilize non-FDA-approved drugs, local partners are free to do so at their own discretion; however, AIDSRelief does assist these patients by supporting staff (clinical, community, and counseling), laboratory (including CD4 testing), and drugs for opportunistic infections and HIV-related symptoms. Because PEPFAR-supported staff and facilities are directly responsible for providing this care to patients, the numbers are included within this report.
A11: Table 4: Cohort Information: There are several reasons why some local partner treatment facilities have patients that do not get a repeat 6 and 12 month CD4 count. Efforts are being made to ensure all patients receive repeat 6 month CD4 counts
A12: a. Clinicians may forget to carry out a repeat CD4 count. Using best practices from one local partner (Maua Methodist Hospital) that is very consistent with obtaining repeat CD4 counts we are in the process of rectifying this by improving the linkage between data management and the clinicians to help clinicians remember which patients require a repeat CD4.
A13: b. Occasionally funding or reagents was not available or the CD4 machine was out of order. Several local partner treatment facilities had to outsource to obtain their CD4s and the clinic they outsourced to may have had one of the above problems.
A14: Table 2, Pregnant females: Following improved data capture and entry of this information into local partner databases the number of pregnant females on ARVs has increased.
A15: Summary:
A16: This worksheet provides summary data from the 19 active AIDSRelief local partner treatment facilities.
A17: PCEA Chogoria Hospital
A18: Receives ARVs from 2 sources: PEPFAR and GoK
A19: Figures are obtained from their CAREWare database that collects full clinical information on all patients.
A20: Table 1 Cell 1 a,b,c,d: Previously reported figures of 134, 381, 123, 866 were incorrect and the corrected figures are 131, 385, 119, 871
A21: Table 2 Cell 1 a, b, d: Previously reported figures of 90, 288, 75, 577 were incorrect and corrected figures are 89, 289, 65, 561
A22: Consolata Hospital
A23: This local partner joined the AIDSRelief program in October 2005. They already had several self pay patients on ARVs. An electronic register was introduced in October 2005 to facilitate reporting of all patients under HIV care and treatment. In addition the local partner treatment facility was trained on the use of CAREWare to collect comprehensive clinical data on all their patients. Both sources were used to provide the statistics for this report.
A24: Table 1 Cell c, d: Previously reported figures of 15, 358 were incorrect and the corrected figures are 14, 359
A25: Table 2 Cell a, d: Previously reported figures of 17, 235 were incorrect and the corrected figures are 16, 240
A26: Kendu Bay Adventist Hospital
A27: Receives ARVs from 2 sources: PEPFAR and GoK
A28: This facility joined the AIDSRelief program in September 2005. They already had patients on ARVs whose drugs were provided by the Government of Kenya. All patients on ARVs are recorded in a manual ARV register as well as a daily activity register maintained
A29: Table 1 Cell 1 a,b,c,d: Previously reported figures of 63, 444, 85, 1054 were incorrect and corrected figures are 61, 447, 81, 1060.
A30: Table 2 a,b,c,d: Previously reported figures of 10, 215, 15, 448 were incorrect and corrected figures are 7, 218, 13, 444
A31: Kijabe Hospital
A32: The facility maintains a patient register in excel showing patients under the AIDSRelief program that come on a monthly basis. They also maintain clinical data on all patients in a CAREWare database. Both sources were used to provide the statistics for this report.
A33: Table 1 a, b, c,d: Previously reported figures of 133, 540, 144, 1276 were incorrect. The corrected figures are 129, 543, 140, 1280
A34: Table 2 b, c: Previously reported figures of 343, 99 were incorrect. The corrected figures are 344, 97
A35: PCEA Kikuyu Hospital
A36: Receives ARVs from 2 sources: PEPFAR and GoK
A37: Table 1 a, b, d. Previously reported numbers of 43, 262, 526 were incorrect and should have been 41, 266, 528
A38: Lugulu Hospital
A39: This facility joined the AIDSRelief program in July 2006. They already had patients on ARVs whose drugs were provided by the Government of Kenya. All patients on ARVs are recorded in a manual ARV register as well as a daily activity register maintained
A40: Table 1 b, c, d: Previously reported figures of 166, 25, 445 were incorrect and should be 168, 24, 444
A41: Table 2 b and c. Previously reported numbers of 86, 1 were incorrect and should have been 87, 2
A42: Table 4: They had several previous patients that were on ARVs but no CD4 records were available for these patients
A43: Maseno Hospital
A44: This facility joined the AIDSRelief program in October 2006.
A45: Mater Hospital
A46: This facility joined the AIDSRelief program in October 2006. They received many transfers in of patients who were previously at St. Marys.
A47: Maua Methodist
A48: Receives ARVs from 2 sources: PEPFAR and GoK
A49: Figures are obtained from an accurate Access database which is regularly updated, with routine data validation carried out. The linkage between data management staff and the clinical staff is excellent.
A50: Archdiocese of Mombasa CBHC
A51: Receives ARVs from 2 sources: PEPFAR and a Canadian funded program
A52: Table 1 d: Previously reported figure of 468 was incorrect and should be 469
A53: Table 2 b and d. Previously reported numbers of 73, 271were incorrect and should have been 75, 274
A54: Mutomo Mission Hospital
A55: This facility joined the AIDSRelief program in August 2006. They already had patients on ARVs whose drugs were provided by the Government of Kenya. All patients on ARVs are recorded in a manual ARV register as well as a daily activity register maintained
A56: Table 1 a, b, c, d: Previously reported figures of 29, 67, 27, 208 were incorrect and should have been 27, 61, 31, 212
A57: Table 2 a, b, c, d: Previously reported figures of 11, 41, 4, 90 were incorrect and should have been 16, 53, 8, 123
A58: Table 4: They had several existing patients that were on ARVs but no CD4 records were available for these patients
A59: Our Lady of Lourdes Mwea Mission Hospital
A60: Receives ARVs from 2 sources: PEPFAR and GoK
A61: Table 1 a,b,d: Previously reported figures of 53, 171, 368 were incorrect and should be 48, 175, 369
A62: Table 2 b: Previously recorded figure of 96 was incorrect and should be 95
A63: Holy Family Centre, Nazareth hospital
A64: Receives ARVs from 2 sources: PEPFAR and GoK
A65: Figures are obtained from a drug inventory database used in pharmacy as well as the CAREWare database which is regularly updated, with data cleaning routines carried out.
A66: Table 1 a, b, c, d: Previously reported figures of 107, 664, 78, 1062 were incorrect and should have been 100, 651, 76, 1057
A67: Table 2 a, b, c, d: Previously reported figures of 86, 597, 58, 883 were incorrect and should have been 85, 596, 59, 893
A68: St. Camillus:
A69: Receives ARVs from only 1 source: PEPFAR. The facility no longer has GoK funded patients
A70: Table 1 Cell 1 a,b, c,d: Previously reported figures of 63, 574, 72, 1180 were incorrect. The corrected figures are 70, 580, 70, 1181
A71: Table 2 Cell 1 a,b,c, d: Previously reported figures of 39, 232, 37, 438 were incorrect. The corrected figures are 38, 237, 34, 445
A72: St. Elizabeth’s Hospital Mukumu:
A73: The facility maintains a patient register in excel showing patients under the AIDS Relief program that come on a monthly basis. They also maintain clinical data on all patients in a CAREWare database.
A74: Table 1 b,c, d: Previously reported figures of 247, 54, 720 were incorrect. The corrected figures are 246, 51, 725
A75: Table 2 a, b, c, d: Previously reported figures of 13, 157, 17, 471 were incorrect. The corrected figures are 14, 161, 16, 475
A76: St. Joseph Migori:
A77: Receives ARVs from 2 sources: PEPFAR and GoK
A78: Table 1 a, b, d: Previously reported figures of 47, 369, 653 were incorrect. The corrected figures are 45, 370, 654
A79: Table 2 b, d: Previously reported figures of 6, 177 were incorrect. The corrected figures are 5, 178
A80: St. Joseph Nyabondo:
A81: This facility joined the AIDSRelief program in November 2006. It receives ARVs from both PEPFAR as well as the GoK.
A82: St. Monica:
A83: Receives ARVs from 2 sources: PEPFAR, and GoK
A84: Table 1 cell a,b, c, d: Previously reported numbers of 102, 613, 79, 1556 were incorrect and corrected numbers are 98, 616, 77, 1558
A85: Table 2 a, b, c: Previously reported figures of 49, 282, 34 were incorrect and should have been 47, 284, 33
A86: PCEA Tumutumu Hospital
A87: Receives ARVs from 2 sources: PEPFAR and the GoK
A88: Table 1 c: Previously reported figure of 50 was incorrect and corrected figure is 51
A89: Table 2 cell a, b, c d: Previously reported figures of 13, 116, 29, 262 were incorrect and corrected figures are 14, 119, 32, 265
A90: Kenya Training Numbers
A91: The trainings shown within table 3 of the summary sheet use both AIDSRelief and NASCOP developed curriculums. The providers being trained are primarily from AIDSRelief facilities, however at several trainings external participants are also invited. 2 CMEs were conducted in the quarter, and AIDSRelief supported a NASCOP pediatric training for non AIDSRelief CHAK sites November 6th - 11th, thus helping to build the capacity of the faith-based health sector in Kenya as a whole.
A92: Below is the information for additional trainings that were conducted during the quarter.
A93: Training Name
A94: Finance and Compliance training: Nairobi, 5 days, 28 participants from 19 local partners
A95: Strategic information data validation workshop: Mwea, 1 day 5 M&E staff from 5 local partners
A96: Strategic information data validation workshop: Kendu, 1 day 4 M&E staff from 4 local partners
A97: Strategic information data validation workshop: St. Monica, 1 day 5 M&E staff from 4 local partners
A98: Strategic information data validation workshop: Chogoria, 1 day 5 M&E staff from 4 local partners
A99: M&E + Electronic Data Management - Mater 5 days, 1 M&E staff
A100: M&E + Electronic Data Management - Maseno 5 days, 2 M&E staff
A101: M&E + Electronic Data Management - Nyabondo 5 days, 1 M&E staff

Sheet: LPTF
B2: Quarterly, Facility-Based HIV Care/ART Reporting Form
C4: Date facility began receiving support from PEPFAR (dd/mm/yy): | E4: 2010-05-01T00:00:00.000
C5: Quarter beginning (dd/mm/yy): | E5: 2010-04-01T00:00:00.000 | H5: Quarter ending (dd/mm/yy): | L5: 2010-06-30T00:00:00.000
C6: Grantee: | E6: AIDSRELIEF | H6: Facility: | L6: kv_kenya_borntolive
C7: Location: | E7: kv_kenya_borntolive | H7: Country:
C10: 1.0 HIV Palliative Care (non-ART and ART care)
D11: Cumulative number enrolled in HIV care by the beginning of Quarter | F11: NEW enrollees in HIV care during the Quarter | H11: Cumulative number enrolled in HIV care by the end of the Quarter | P11: Total number who received HIV care during the Quarter | S11: error check | U11: % of Active patients on ARVs
C12: 1. Males (0-14 years) | D12: a. | E12: 0 | F12: f. | G12: 0 | H12: k. | I12: =SUM(RC[-4]:RC[-2]) -> 0 | P12: oo. | Q12: 1 | S12: =RC[-10]-RC[-2] -> -1 | U12: =R[23]C[-4]/R[4]C[-4]*100 -> 250
C13: 2. Males (15 or more years) | D13: b. | E13: 0 | F13: g. | G13: 0 | H13: l. | I13: =SUM(RC[-4]:RC[-2]) -> 0 | P13: pp. | Q13: 0 | S13: =RC[-10]-RC[-2] -> 0
C14: 3. Females (0-14 years) | D14: c. | E14: 0 | F14: h. | G14: 0 | H14: m. | I14: =SUM(RC[-4]:RC[-2]) -> 0 | P14: qq. | Q14: 0 | S14: =RC[-10]-RC[-2] -> 0
C15: 4. Females (15 or more years) | D15: d. | E15: 0 | F15: i. | G15: 2 | H15: n. | I15: =SUM(RC[-4]:RC[-2]) -> 2 | P15: rr. | Q15: 1 | S15: =RC[-10]-RC[-2] -> 1
C16: Total | D16: e. | E16: =SUM(R[-4]C:R[-1]C) -> 0 | F16: j. | G16: =SUM(R[-4]C:R[-1]C) -> 2 | H16: o. | I16: =SUM(R[-4]C:R[-1]C) -> 2 | P16: uu. | Q16: =SUM(R[-4]C:R[-1]C) -> 2 | S16: =RC[-10]-RC[-2] -> 0
K18: Number in HIV care during the Quarter & eligible for ART, but NOT started ART by the end of the Quarter (subset of 1uu.) | P18: vv. | Q18: 0
C20: 1.1 Pediatric HIV Palliative Care (non-ART and ART care) (subset of Lines 1 and 3 in Table 1.0)
C21: Males (0-1 year) | D21: a. | E21: 0 | F21: g. | G21: 0 | H21: m. | P21: s. | Q21: 1 | S21: =RC[-10]-RC[-2] -> -1
C22: Males (2-4 years) | D22: b. | E22: 0 | F22: h. | G22: 0 | H22: n. | P22: t. | Q22: 0 | S22: =RC[-10]-RC[-2] -> 0
C23: Males (5-14 years) | D23: c. | E23: 0 | F23: i. | G23: 0 | H23: o. | P23: u. | Q23: 1 | S23: =RC[-10]-RC[-2] -> -1
C24: Females (0-1year) | D24: d. | E24: 0 | F24: j. | G24: 0 | H24: p. | P24: v. | Q24: 0 | S24: =RC[-10]-RC[-2] -> 0
C25: Females (2-4 years) | D25: e. | E25: 0 | F25: k. | G25: 0 | H25: q. | P25: w. | Q25: 0 | S25: =RC[-10]-RC[-2] -> 0
C26: Females (5-14 years) | D26: f. | E26: 0 | F26: l. | G26: 0 | H26: r. | P26: x. | Q26: 0 | S26: =RC[-10]-RC[-2] -> 0
C29: 2.0 ART Care
D30: Cumulative number started on ART by the beginning of the Quarter | F30: Number started on ART in program during the Quarter (includes NEW and TRANSFERS) | H30: Cumulative number started on ART by the end of the Quarter | K30: Number NEW on ART during the Quarter (subset of 2h-2n) | M30: Number on ART who TRANSFERRED in during the Quarter (subset of 2h-2n) | P30: Total number on ART at the end of the Quarter (CURRENT)
C31: 1. Males (0-14 years) | D31: a. | E31: 1 | F31: g. | G31: 0 | H31: m. | I31: =SUM(RC[-4]:RC[-2]) -> 1 | K31: aa. | L31: 0 | M31: gg. | N31: 0 | P31: mm. | Q31: 1 | S31: error check | U31: =R[-1]C[-9]+R[-1]C[-7]-R[-1]C[-14] -> 0
C32: 2. Males (15 or more years) | D32: b. | E32: 0 | F32: h. | G32: 0 | H32: n. | I32: =SUM(RC[-4]:RC[-2]) -> 0 | K32: bb. | L32: 0 | M32: hh. | N32: 0 | P32: nn. | Q32: 0 | S32: =RC[-10]-RC[-2]-R[47]C[-2] -> 0 | U32: =R[-1]C[-9]+R[-1]C[-7]-R[-1]C[-14] -> 0
C33: 3. Females (0-14 years) | D33: c. | E33: 0 | F33: i. | G33: 0 | H33: o. | I33: =SUM(RC[-4]:RC[-2]) -> 0 | K33: cc. | L33: 0 | M33: ii. | N33: 0 | P33: oo. | Q33: 0 | U33: =R[-1]C[-9]+R[-1]C[-7]-R[-1]C[-14] -> 0
C34: 4. Females (15 or more years) | D34: d. | E34: 0 | F34: j. | G34: 1 | H34: p. | I34: =SUM(RC[-4]:RC[-2]) -> 1 | K34: dd. | L34: 0 | M34: jj. | N34: 0 | P34: pp. | Q34: 4 | S34: =RC[-10]-RC[-2]-R[47]C[-2] -> -3 | U34: =R[-1]C[-9]+R[-1]C[-7]-R[-1]C[-14] -> 0 | V34: =R[-2]C[-5]+RC[-5]-R[95]C[-12] -> 4
C35: Total | D35: e. | E35: =SUM(R[-4]C:R[-1]C) -> 1 | F35: k. | G35: =SUM(R[-4]C:R[-1]C) -> 1 | H35: q. | I35: =SUM(R[-4]C:R[-1]C) -> 2 | K35: ee. | L35: =SUM(R[-4]C:R[-1]C) -> 0 | M35: kk. | N35: =SUM(R[-4]C:R[-1]C) -> 0 | P35: qq. | Q35: =SUM(R[-4]C:R[-1]C) -> 5 | U35: =R[-1]C[-9]+R[-1]C[-7]-R[-1]C[-14] -> -1
C37: 5. Pregnant females (subset of total) | D37: f. | E37: 0 | F37: l. | G37: 0 | H37: r. | I37: =SUM(RC[-4]:RC[-2]) -> 0 | K37: ff. | L37: 0 | M37: ll. | N37: 0 | P37: rr. | Q37: 0
K40: No. of persons on ART at the end of the Quarter who were treated with USG-funded ART (subset of 2qq.) | P40: ss.
C43: 2.1 Pediatric ART Care (subset of Lines 1 and 3 in Table 2.0)
C44: Males (0-1 year) | D44: a. | E44: 0 | F44: g. | G44: 0 | H44: m. | I44: =SUM(RC[-4]:RC[-2]) -> 0 | K44: s. | L44: 0 | M44: y. | N44: 0 | P44: ee. | Q44: 0 | S44: =RC[-10]-RC[-2]-R[41]C[-2] -> 0 | U44: =R[-1]C[-9]+R[-1]C[-7]-R[-1]C[-14] -> 0 | V44: =RC[-5]+R[3]C[-5]-R[85]C[-18] -> 0
C45: Males (2-4 years) | D45: b. | E45: 0 | F45: h. | G45: 0 | H45: n. | I45: =SUM(RC[-4]:RC[-2]) -> 0 | K45: t. | L45: 0 | M45: z. | N45: 0 | P45: ff. | Q45: 0 | S45: =RC[-10]-RC[-2]-R[41]C[-2] -> 0 | U45: =R[-1]C[-9]+R[-1]C[-7]-R[-1]C[-14] -> 0
C46: Males (5-14 years) | D46: c. | E46: 0 | F46: i. | G46: 0 | H46: o. | I46: =SUM(RC[-4]:RC[-2]) -> 0 | K46: u. | L46: 0 | M46: aa. | N46: 0 | P46: gg. | Q46: 1 | S46: =RC[-10]-RC[-2]-R[41]C[-2] -> -1 | U46: =R[-1]C[-9]+R[-1]C[-7]-R[-1]C[-14] -> 0 | V46: =R[-1]C[-5]+R[2]C[-5]-R[83]C[-16] -> 0
C47: Females (0-1year) | D47: d. | E47: 0 | F47: j. | G47: 0 | H47: p. | I47: =SUM(RC[-4]:RC[-2]) -> 0 | K47: v. | L47: 0 | M47: bb. | N47: 0 | P47: hh. | Q47: 0 | S47: =RC[-10]-RC[-2]-R[41]C[-2] -> 0 | U47: =R[-1]C[-9]+R[-1]C[-7]-R[-1]C[-14] -> 0
C48: Females (2-4 years) | D48: e. | E48: 0 | F48: k. | G48: 0 | H48: q. | I48: =SUM(RC[-4]:RC[-2]) -> 0 | K48: w. | L48: 0 | M48: cc. | N48: 0 | P48: ii. | Q48: 0 | S48: =RC[-10]-RC[-2]-R[41]C[-2] -> 0 | U48: =R[-1]C[-9]+R[-1]C[-7]-R[-1]C[-14] -> 0
C49: Females (5-14 years) | D49: f. | E49: 0 | F49: l. | G49: 0 | H49: r. | I49: =SUM(RC[-4]:RC[-2]) -> 0 | K49: x. | L49: 0 | M49: dd. | N49: 0 | P49: jj. | Q49: 0 | S49: =RC[-10]-RC[-2]-R[41]C[-2] -> 0 | U49: =R[-1]C[-9]+R[-1]C[-7]-R[-1]C[-14] -> 0 | V49: =RC[-5]+R[-3]C[-5]-R[80]C[-14] -> 1
I51: Page 1
C55: 3. Training in ART and HIV Care* | D55: Physicians | F55: Nurses | H55: Other healthcare workers | K55: Total | N55: *Please provide training numbers by country, not by facility, for each grantee
C56: 1. Number of persons trained in ART care during the Quarter | D56: a. | F56: b. | H56: c. | K56: d. | L56: =SUM(RC[-7],RC[-5],RC[-3]) -> 0
C57: 2. No. trained in (non-ART) HIV palliative care during the Quarter | K57: e.
C59: 4.1 Change in CD4+ count and adherence to ART for 6-Quarter cohort (>6 years old) | I59: 4.2 Change in CD4+ count and adherence to ART for 12-Quarter cohort (>6 years old)
D60: Baseline | F60: 6 Months | M60: Baseline | P60: 12 Months
C61: Quarter when cohort started ART | D61: a. | E61: Aug 2009 - Oct 2009 | H61: Quarter when cohort started ART | M61: a.
C62: Number of persons in cohort | D62: b. | E62: 0 | F62: e. | G62: 2 | H62: Number of persons in cohort | M62: b. | N62: 0 | P62: e. | Q62: 13
C63: No. in cohort who have CD4+ counts | D63: c. | E63: 0 | F63: f. | G63: 0 | H63: No. in cohort who have CD4+ counts | M63: c. | N63: 0 | P63: f. | Q63: 0
C64: Median CD4+ count for cohort | D64: d. | F64: g. | H64: Median CD4+ count for cohort | M64: d. | P64: g.
C65: No. in cohort who received ARVs for 6 out of 6 Months | F65: h. | G65: 0 | H65: No.of persons in cohort who received ARVs for 12 out of 12 Months | P65: h. | Q65: 0
C68: LEGEND for Table 4
C69: Reporting Period patients being reported during the time Quarter: | D69: 6-Quarter cohorts patients who started on ART in the preceding Quarters of: | F69: 12-Quarter cohorts patients who started on ART in the previous year, during the Quarters of:
C70: October 1 - December 31 | D70: Feb, Mar, Apr | F70: Aug, Sept, Oct
C71: January 1 - March 31 | D71: May, June, July | F71: Nov, Dec, Jan
C72: April 1 - June 30 | D72: Aug, Sept, Oct | F72: Feb, Mar, April
C73: July 1 - September 30 | D73: Nov, Dec, Jan | F73: May, June, July
C76: 6.0 ART Care Follow-Up - Number of persons who started on ART at the facility in the EP program who were NOT on ART at the end of the Quarter
C77: Reason | D77: Stopped ART | F77: Transferred Out | H77: Death | K77: Lost to Follow-up | M77: Unknown | P77: TOTAL
C78: 1. Males (0-14 years) | D78: a. | E78: 0 | F78: f. | G78: 0 | H78: k. | I78: 0 | K78: p. | L78: 0 | M78: u. | N78: 0 | P78: z. | Q78: =SUM(RC[-12]:RC[-10]:RC[-8]:RC[-5]:RC[-3]) -> 0
C79: 2. Males (15 or more years) | D79: b. | E79: 0 | F79: g. | G79: 0 | H79: l. | I79: 0 | K79: q. | L79: 0 | M79: v. | N79: 0 | P79: aa. | Q79: =SUM(RC[-12]:RC[-10]:RC[-8]:RC[-5]:RC[-3]) -> 0
C80: 3. Females (0-14 years) | D80: c. | E80: 0 | F80: h. | G80: 0 | H80: m. | I80: 0 | K80: r. | L80: 0 | M80: w. | N80: 0 | P80: bb. | Q80: =SUM(RC[-12]:RC[-10]:RC[-8]:RC[-5]:RC[-3]) -> 0
C81: 4. Females (15 or more years) | D81: d. | E81: 0 | F81: i. | G81: 0 | H81: n. | I81: 0 | K81: s. | L81: 0 | M81: x. | N81: 0 | P81: cc. | Q81: =SUM(RC[-12]:RC[-10]:RC[-8]:RC[-5]:RC[-3]) -> 0
C82: Total | D82: e. | E82: =SUM(R[-4]C:R[-1]C) -> 0 | F82: j. | G82: =SUM(R[-4]C:R[-1]C) -> 0 | H82: o. | I82: =SUM(R[-4]C:R[-1]C) -> 0 | K82: t. | L82: =SUM(R[-4]C:R[-1]C) -> 0 | M82: y. | N82: =SUM(R[-4]C:R[-1]C) -> 0 | P82: dd. | Q82: =SUM(R[-4]C:R[-3]C:R[-2]C:R[-1]C) -> 0
C84: 6.1 Pediatric ART Care Follow-Up (subset of Lines 1 and 3 in Table 6.0)
C85: Males (0-1 year) | D85: a. | E85: 0 | F85: g. | G85: 0 | H85: m. | I85: 0 | K85: s. | L85: 0 | M85: y. | N85: 0 | P85: ee.
C86: Males (2-4 years) | D86: b. | E86: 0 | F86: h. | G86: 0 | H86: n. | I86: 0 | K86: t. | L86: 0 | M86: z. | N86: 0 | P86: ff.
C87: Males (5-14 years) | D87: c. | E87: 0 | F87: i. | G87: 0 | H87: o. | I87: 0 | K87: u. | L87: 0 | M87: aa. | N87: 0 | P87: gg.
C88: Females (0-1year) | D88: d. | E88: 0 | F88: j. | G88: 0 | H88: p. | I88: 0 | K88: v. | L88: 0 | M88: bb. | N88: 0 | P88: hh.
C89: Females (2-4 years) | D89: e. | E89: 0 | F89: k. | G89: 0 | H89: q. | I89: 0 | K89: w. | L89: 0 | M89: cc. | N89: 0 | P89: ii.
C90: Females (5-14 years) | D90: f. | E90: 0 | F90: l. | G90: 0 | H90: r. | I90: 0 | K90: x. | L90: 0 | M90: dd. | N90: 0 | P90: jj.
I92: Page 2
C95: 5. Number of Active patients on each regimen at the end of the Quarter
C96: Regimen | D96: Age Group (Years) | M96: Total
D97: 0-1 | F97: 2-4 | H97: 5-14 | J97: Adults(>14) | P97: ARV | Q97: # of adults | R97: % Usage (Adults)
C98: d4T15mg - 3TC-NVP | M98: =SUM(RC[-9]:RC[-1]) -> 0 | P98: D4T 30mg | Q98: =SUM(R[2]C[-7],R[6]C[-7],R[10]C[-7]) -> 0 | R98: =RC[-1]/R129C10 -> #DIV/0!
C99: d4T20mg - 3TC-NVP | M99: =SUM(RC[-9]:RC[-1]) -> 0 | P99: D4T 40mg | Q99: =SUM(R[2]C[-7],R[6]C[-7],R[10]C[-7]) -> 0 | R99: =RC[-1]/R129C10 -> #DIV/0!
C100: d4T30mg - 3TC-NVP | M100: =SUM(RC[-9]:RC[-1]) -> 0 | P100: TDF | Q100: =SUM(R[21]C[-7]:R[23]C[-5]) -> 0 | R100: =RC[-1]/R129C10 -> #DIV/0!
C101: d4T40mg - 3TC-NVP | M101: =SUM(RC[-9]:RC[-1]) -> 0 | P101: AZT | Q101: =SUM(R[12]C[-7]:R[17]C[-5]) -> 0 | R101: =RC[-1]/R129C10 -> #DIV/0!
C102: d4T15mg - 3TC-EFV | M102: =SUM(RC[-9]:RC[-1]) -> 0 | P102: Kaletra | Q102: =SUM(R[4]C[-7],R[5]C[-7],R[6]C[-7],R[7]C[-7],R[10]C[-7],R[13]C[-7],R[16]C[-7],R[21]C[-7],R[23]C[-7],R[24]C[-7]) -> 0 | R102: =RC[-1]/R129C10 -> #DIV/0!
C103: d4T20mg - 3TC-EFV | M103: =SUM(RC[-9]:RC[-1]) -> 0 | P103: Combivir | Q103: =SUM(R[7]C[-7],R[8]C[-7],R[9]C[-7]) -> 0 | R103: =RC[-1]/R129C10 -> #DIV/0!
C104: d4T30mg - 3TC-EFV | M104: =SUM(RC[-9]:RC[-1]) -> 0 | P104: NVP | Q104: =SUM(R[-6]C[-7]:R[-3]C[-7],R[6]C[-7],R[9]C[-7],R[12]C[-7],R[15]C[-7],R[17]C[-7]) -> 0 | R104: =RC[-1]/R129C10 -> #DIV/0!
C105: d4T40mg - 3TC-EFV | M105: =SUM(RC[-9]:RC[-1]) -> 0 | P105: EFV | Q105: =SUM(R[-3]C[-7]:RC[-5],R[6]C[-7],R[9]C[-7],R[12]C[-7],R[15]C[-7],R[17]C[-7],R[19]C[-7]:R[20]C[-7],R[22]C[-7],R[23]C[-7]) -> 0 | R105: =RC[-1]/R129C10 -> #DIV/0!
C106: d4T15mg - 3TC-LPV/r | M106: =SUM(RC[-9]:RC[-1]) -> 0 | P106: 3TC | Q106: =SUM(R[-8]C[-7]:R[9]C[-5],R[15]C[-7]:R[19]C[-5],R[22]C[-7]) -> 0 | R106: =RC[-1]/R129C10 -> #DIV/0!
C107: d4T20mg - 3TC-LPV/r | M107: =SUM(RC[-9]:RC[-1]) -> 0
C108: d4T30mg - 3TC-LPV/r | M108: =SUM(RC[-9]:RC[-1]) -> 0
C109: d4T40mg - 3TC-LPV/r | M109: =SUM(RC[-9]:RC[-1]) -> 0
C110: Combivir -NVP | M110: =SUM(RC[-9]:RC[-1]) -> 0
C111: Combivir -EFV | M111: =SUM(RC[-9]:RC[-1]) -> 0
C112: Combivir -LPV/r | M112: =SUM(RC[-9]:RC[-1]) -> 0
C113: ZDV-3TC-NVP | M113: =SUM(RC[-9]:RC[-1]) -> 0
C114: ZDV-3TC-EFV | M114: =SUM(RC[-9]:RC[-1]) -> 0
C115: ZDV-3TC-LPV/r | M115: =SUM(RC[-9]:RC[-1]) -> 0
C116: ZDV-ddI-NVP | M116: =SUM(RC[-9]:RC[-1]) -> 0
C117: ZDV-ddI-EFV | M117: =SUM(RC[-9]:RC[-1]) -> 0
C118: ZDV-ddI-LPV/r | M118: =SUM(RC[-9]:RC[-1]) -> 0
C119: d4T-ddI-NVP | M119: =SUM(RC[-9]:RC[-1]) -> 0
C120: d4T-ddI-EFV | M120: =SUM(RC[-9]:RC[-1]) -> 0
C121: TDF-3TC-NVP | M121: =SUM(RC[-9]:RC[-1]) -> 0
C122: TDF-3TC-EFV | M122: =SUM(RC[-9]:RC[-1]) -> 0
C123: TDF-3TC-LPV/r | M123: =SUM(RC[-9]:RC[-1]) -> 0
C124: NFV-EFV-3TC | M124: =SUM(RC[-9]:RC[-1]) -> 0
C125: 3TC-EFV-LPV/r | M125: =SUM(RC[-9]:RC[-1]) -> 0
C126: LPV/r | M126: =SUM(RC[-9]:RC[-1]) -> 0
C127: Truvada/EFV | M127: =SUM(RC[-9]:RC[-1]) -> 0
C128: DDi-3TC-EFV | M128: =SUM(RC[-9]:RC[-1]) -> 0
C129: Total | D129: =SUM(R[-31]C:R[-1]C[1]) -> 0 | F129: =SUM(R[-31]C:R[-1]C[1]) -> 0 | H129: =SUM(R[-31]C:R[-1]C[1]) -> 0 | J129: =SUM(R[-31]C:R[-1]C[2]) -> 0 | M129: =SUM(RC[-9]:RC[-1]) -> 0